{
  "_comment": "Editorial index over the sealed ledger. It classifies who acted, how, and what happened next. It is not part of the seal: changing this file never changes an entry or its hash. Entries without an annotation are shown as pending classification.",
  "actorKinds": {
    "ministry": { "en": "Ministry", "id": "Kementerian", "nl": "Ministerie", "de": "Ministerium" },
    "police": { "en": "Police", "id": "Kepolisian", "nl": "Politie", "de": "Polizei" },
    "military": { "en": "Military", "id": "Militer", "nl": "Krijgsmacht", "de": "Militär" },
    "security": { "en": "Security forces", "id": "Aparat keamanan", "nl": "Veiligheidstroepen", "de": "Sicherheitskräfte" },
    "executive": { "en": "Executive", "id": "Eksekutif", "nl": "Uitvoerende macht", "de": "Exekutive" },
    "judiciary": { "en": "Justice system", "id": "Sistem peradilan", "nl": "Justitie", "de": "Justiz" },
    "unknown": { "en": "Not established", "id": "Belum diketahui", "nl": "Niet vastgesteld", "de": "Nicht festgestellt" }
  },
  "actors": {
    "deppen": {
      "kind": "ministry",
      "short": "Deppen",
      "name": { "en": "Ministry of Information", "id": "Departemen Penerangan", "nl": "Ministerie van Voorlichting", "de": "Informationsministerium" },
      "note": { "en": "Dissolved in 1999.", "id": "Dibubarkan pada 1999.", "nl": "Opgeheven in 1999.", "de": "1999 aufgelöst." },
      "aliases": ["Ministry of Information", "Departemen Penerangan", "Information Ministry"]
    },
    "security-forces": {
      "kind": "security",
      "short": "Security forces",
      "name": { "en": "Security forces (unit not specified)", "id": "Aparat keamanan (satuan tidak disebutkan)", "nl": "Veiligheidstroepen (eenheid niet vermeld)", "de": "Sicherheitskräfte (Einheit nicht angegeben)" },
      "aliases": ["security forces", "aparat keamanan"]
    },
    "polri": {
      "kind": "police",
      "short": "Polri",
      "name": { "en": "Indonesian National Police", "id": "Kepolisian Negara Republik Indonesia", "nl": "Indonesische Nationale Politie", "de": "Indonesische Nationalpolizei" },
      "aliases": ["Polri", "National Police", "police", "polisi", "kepolisian"]
    },
    "polda-metro": {
      "kind": "police",
      "short": "Polda Metro Jaya",
      "parent": "polri",
      "name": { "en": "Jakarta Metropolitan Regional Police", "id": "Kepolisian Daerah Metro Jaya", "nl": "Regionale politie Groot-Jakarta", "de": "Regionalpolizei Groß-Jakarta" },
      "aliases": ["Polda Metro Jaya"]
    },
    "tni": {
      "kind": "military",
      "short": "TNI",
      "name": { "en": "Indonesian National Armed Forces", "id": "Tentara Nasional Indonesia", "nl": "Indonesische Nationale Strijdkrachten", "de": "Indonesische Nationale Streitkräfte" },
      "aliases": ["TNI", "soldiers", "armed forces", "military", "tentara"]
    },
    "central-gov": {
      "kind": "executive",
      "short": "Government",
      "name": { "en": "President and central government", "id": "Presiden dan pemerintah pusat", "nl": "President en centrale regering", "de": "Präsident und Zentralregierung" },
      "aliases": ["central government", "President", "Presiden", "pemerintah pusat"]
    },
    "kominfo": {
      "kind": "ministry",
      "short": "Kominfo / Komdigi",
      "name": { "en": "Ministry of Communication (Kominfo, now Komdigi)", "id": "Kementerian Komunikasi (Kominfo, kini Komdigi)", "nl": "Ministerie van Communicatie (Kominfo, nu Komdigi)", "de": "Kommunikationsministerium (Kominfo, heute Komdigi)" },
      "note": { "en": "Restructured as the Ministry of Communication and Digital Affairs (Komdigi) in October 2024.", "id": "Direstrukturisasi menjadi Kementerian Komunikasi dan Digital (Komdigi) pada Oktober 2024.", "nl": "In oktober 2024 omgevormd tot het Ministerie van Communicatie en Digitale Zaken (Komdigi).", "de": "Im Oktober 2024 zum Ministerium für Kommunikation und Digitales (Komdigi) umgebaut." },
      "aliases": ["Kominfo", "Komdigi", "Ministry of Communication"]
    },
    "polhukam": {
      "kind": "ministry",
      "short": "Kemenko Polhukam",
      "name": { "en": "Coordinating Ministry for Political, Legal and Security Affairs", "id": "Kementerian Koordinator Bidang Politik, Hukum, dan Keamanan", "nl": "Coördinerend Ministerie voor Politieke, Juridische en Veiligheidszaken", "de": "Koordinierendes Ministerium für Politik, Recht und Sicherheit" },
      "aliases": ["Polhukam", "Coordinating Minister for Political, Legal and Security Affairs"]
    },
    "court-jakpus": {
      "kind": "judiciary",
      "short": "PN Jakarta Pusat",
      "name": { "en": "Central Jakarta District Court", "id": "Pengadilan Negeri Jakarta Pusat", "nl": "Rechtbank Centraal-Jakarta", "de": "Bezirksgericht Zentral-Jakarta" },
      "aliases": ["Central Jakarta District Court", "Pengadilan Negeri Jakarta Pusat"]
    },
    "prosecution": {
      "kind": "judiciary",
      "short": "Kejaksaan",
      "name": { "en": "Public prosecution service", "id": "Kejaksaan", "nl": "Openbaar ministerie", "de": "Staatsanwaltschaft" },
      "aliases": ["prosecution", "prosecutor", "Kejaksaan", "jaksa"]
    },
    "unidentified": {
      "kind": "unknown",
      "short": "Not established",
      "name": { "en": "Not established", "id": "Belum diketahui", "nl": "Niet vastgesteld", "de": "Nicht festgestellt" },
      "aliases": []
    }
  },
  "mechanisms": {
    "physical": { "en": "Physical", "id": "Fisik", "nl": "Fysiek", "de": "Physisch" },
    "administrative": { "en": "Administrative", "id": "Administratif", "nl": "Bestuurlijk", "de": "Administrativ" },
    "digital": { "en": "Digital", "id": "Digital", "nl": "Digitaal", "de": "Digital" },
    "legal": { "en": "Legal process", "id": "Proses hukum", "nl": "Juridisch", "de": "Rechtlich" }
  },
  "actions": {
    "licence_revocation": { "mechanism": "administrative", "name": { "en": "Licence revocation", "id": "Pencabutan izin terbit", "nl": "Intrekking van vergunningen", "de": "Lizenzentzug" } },
    "coverage_obstruction": { "mechanism": "administrative", "name": { "en": "Obstructing coverage", "id": "Menghalangi peliputan", "nl": "Belemmeren van verslaggeving", "de": "Behinderung der Berichterstattung" } },
    "detention": { "mechanism": "physical", "name": { "en": "Arrest and detention", "id": "Penangkapan dan penahanan", "nl": "Arrestatie en detentie", "de": "Festnahme und Haft" } },
    "violence": { "mechanism": "physical", "name": { "en": "Physical violence", "id": "Kekerasan fisik", "nl": "Fysiek geweld", "de": "Körperliche Gewalt" } },
    "intimidation": { "mechanism": "physical", "name": { "en": "Intimidation", "id": "Intimidasi", "nl": "Intimidatie", "de": "Einschüchterung" } },
    "crowd_sweeps": { "mechanism": "physical", "name": { "en": "Sweeps and movement restrictions", "id": "Penyisiran dan pembatasan gerak", "nl": "Razzia's en bewegingsbeperkingen", "de": "Razzien und Bewegungseinschränkungen" } },
    "network_restriction": { "mechanism": "digital", "name": { "en": "Network throttling or shutdown", "id": "Pelambatan atau pemutusan jaringan", "nl": "Vertragen of afsluiten van netwerken", "de": "Drosselung oder Abschaltung von Netzen" } },
    "content_removal": { "mechanism": "digital", "name": { "en": "Content takedown", "id": "Penurunan konten", "nl": "Verwijderen van content", "de": "Löschung von Inhalten" } },
    "platform_pressure": { "mechanism": "digital", "name": { "en": "Pressure on platforms", "id": "Tekanan terhadap platform", "nl": "Druk op platforms", "de": "Druck auf Plattformen" } },
    "prosecution": { "mechanism": "legal", "name": { "en": "Prosecution of speech", "id": "Pemidanaan ekspresi", "nl": "Vervolging van meningsuiting", "de": "Strafverfolgung von Äußerungen" } }
  },
  "outcomes": {
    "court_ruled_against": { "class": "remedy", "name": { "en": "Court ruled against the act", "id": "Pengadilan memutus tindakan itu cacat hukum", "nl": "Rechter oordeelde tegen de handeling", "de": "Gericht entschied gegen die Maßnahme" } },
    "appeal_withdrawn": { "class": "remedy", "name": { "en": "State withdrew its appeal", "id": "Negara mencabut bandingnya", "nl": "Staat trok hoger beroep in", "de": "Staat zog die Berufung zurück" } },
    "legal_reform": { "class": "remedy", "name": { "en": "Law changed to forbid the act", "id": "Undang-undang diubah untuk melarang tindakan itu", "nl": "Wet gewijzigd om de handeling te verbieden", "de": "Gesetz geändert, um die Maßnahme zu verbieten" } },
    "acknowledged": { "class": "partial", "name": { "en": "Authority acknowledged the act", "id": "Otoritas mengakui tindakan itu", "nl": "Autoriteit erkende de handeling", "de": "Behörde räumte die Maßnahme ein" } },
    "public_apology": { "class": "partial", "name": { "en": "Public apology and promised review", "id": "Permintaan maaf publik dan janji evaluasi", "nl": "Publieke excuses en toegezegde evaluatie", "de": "Öffentliche Entschuldigung und angekündigte Prüfung" } },
    "measure_lifted": { "class": "partial", "name": { "en": "Measure lifted", "id": "Tindakan dicabut", "nl": "Maatregel opgeheven", "de": "Maßnahme aufgehoben" } },
    "detainees_released": { "class": "partial", "name": { "en": "Detainees released", "id": "Yang ditahan dibebaskan", "nl": "Gedetineerden vrijgelaten", "de": "Festgenommene freigelassen" } },
    "under_inquiry": { "class": "partial", "name": { "en": "Under inquiry by a rights body", "id": "Diselidiki lembaga HAM", "nl": "Onderzoek door een mensenrechteninstantie", "de": "Untersuchung durch eine Menschenrechtsstelle" } },
    "content_restored": { "class": "partial", "name": { "en": "Content restored after appeal", "id": "Konten dipulihkan setelah banding", "nl": "Content hersteld na bezwaar", "de": "Inhalt nach Einspruch wiederhergestellt" } },
    "official_denial": { "class": "deflected", "name": { "en": "Official denial", "id": "Bantahan resmi", "nl": "Officiële ontkenning", "de": "Offizielles Dementi" } },